{
  "schema_version": "governed_path_preparation_receipt_v0",
  "plan_file": "/Users/usbdick/Documents/New project/synrail/fixtures/governed_path_plan_run_001/plan.json",
  "bundle_file": "/Users/usbdick/Documents/New project/synrail/fixtures/governed_path_plan_run_001/bundle.json",
  "run_id": "GOVERNED_PATH_PLAN_RUN_001",
  "task_class": "bounded_router_trigger_fix",
  "bundle_run_matches_plan": true,
  "bundle_task_class_matches_plan": true,
  "planned_required_sections_count": 7,
  "planned_required_sections_present_count": 7,
  "bundle_status": "COMPLETE",
  "missing_required_sections": [],
  "complete_on_first_bundle_pass": true,
  "ready_for_closure": true,
  "next_safe_step": "run closure on the complete planned bundle"
}
