{
  "schema_version": "governed_path_preparation_receipt_v0",
  "plan_file": "/private/tmp/synrail_alpha_telemetry_001/plan.json",
  "bundle_file": "/private/tmp/synrail_alpha_telemetry_001/bundle.json",
  "run_id": "ALPHA_RUN_20260414T112716Z",
  "task_class": "bounded_change",
  "bundle_run_matches_plan": true,
  "bundle_task_class_matches_plan": true,
  "planned_required_sections_count": 7,
  "planned_required_sections_present_count": 2,
  "bundle_status": "INVALID",
  "missing_required_sections": [
    "final_result",
    "diff_provenance",
    "readback",
    "scenario_proof",
    "cleanup_status"
  ],
  "complete_on_first_bundle_pass": false,
  "ready_for_closure": false,
  "next_safe_step": "collect the missing planned proof sections and rebuild the bundle"
}
