{
  "schema_version": "governed_path_preparation_receipt_v0",
  "plan_file": "/Users/usbdick/Documents/New project/synrail/fixtures/acceptance_independence_run_001/lane_missing/plan.json",
  "bundle_file": "/Users/usbdick/Documents/New project/synrail/fixtures/acceptance_independence_run_001/lane_missing/bundle.json",
  "run_id": "ACCEPTANCE_INDEPENDENCE_MISSING_001",
  "task_class": "proof_sensitive_fix",
  "bundle_run_matches_plan": false,
  "bundle_task_class_matches_plan": true,
  "planned_required_sections_count": 7,
  "planned_required_sections_present_count": 6,
  "bundle_status": "PARTIAL",
  "missing_required_sections": [
    "artifact_identity"
  ],
  "complete_on_first_bundle_pass": false,
  "ready_for_closure": false,
  "next_safe_step": "collect the missing planned proof sections and rebuild the bundle"
}
